{
  "$schema": "https://json-schema.org/draft/2020-12/schema",
  "$id": "https://schemas.ai-video-editor.invalid/draft_transaction.schema.json",
  "title": "Committed draft transaction",
  "type": "object",
  "additionalProperties": false,
  "required": [
    "schema_version",
    "transaction_id",
    "request_id",
    "request_sha256",
    "transaction_sha256",
    "previous_transaction_sha256",
    "project_id",
    "draft_id",
    "base_revision_id",
    "kind",
    "origin",
    "pass_group",
    "reason",
    "created_at",
    "target_transaction_id",
    "before",
    "after",
    "operations",
    "status"
  ],
  "properties": {
    "schema_version": { "const": "1.0" },
    "transaction_id": { "$ref": "#/$defs/id" },
    "request_id": { "$ref": "#/$defs/id" },
    "request_sha256": { "$ref": "#/$defs/hash" },
    "transaction_sha256": { "$ref": "#/$defs/hash" },
    "previous_transaction_sha256": {
      "oneOf": [{ "$ref": "#/$defs/hash" }, { "type": "null" }]
    },
    "project_id": { "$ref": "#/$defs/id" },
    "draft_id": { "$ref": "#/$defs/id" },
    "base_revision_id": { "$ref": "#/$defs/id" },
    "kind": { "enum": ["apply", "undo", "redo"] },
    "origin": { "enum": ["manual", "codex", "claude", "api_provider", "magic_wand"] },
    "pass_group": {
      "oneOf": [{ "$ref": "#/$defs/pass_group" }, { "type": "null" }]
    },
    "reason": { "type": "string", "minLength": 1, "maxLength": 1000 },
    "created_at": { "$ref": "#/$defs/timestamp" },
    "target_transaction_id": {
      "oneOf": [{ "$ref": "#/$defs/id" }, { "type": "null" }]
    },
    "before": { "$ref": "#/$defs/state" },
    "after": { "$ref": "#/$defs/state" },
    "operations": {
      "type": "array",
      "description": "A confirmed ripple-delete batch uses disjoint half-open output ranges ordered by descending start time. A source-range restore records one exact missing half-open source-time interval and must be the only operation in its transaction. Both commit through one shared undo history. Undo and redo are separate hash-chained transactions with no direct operations.",
      "maxItems": 64,
      "items": {
        "oneOf": [
          { "$ref": "#/$defs/trim_operation" },
          { "$ref": "#/$defs/split_operation" },
          { "$ref": "#/$defs/ripple_delete_operation" },
          { "$ref": "#/$defs/restore_range_operation" },
          { "$ref": "#/$defs/transcript_cut_operation" },
          { "$ref": "#/$defs/transcript_edit_operation" }
        ]
      }
    },
    "status": { "const": "committed" }
  },
  "allOf": [
    {
      "if": { "properties": { "kind": { "const": "apply" } } },
      "then": {
        "properties": {
          "pass_group": { "$ref": "#/$defs/pass_group" },
          "target_transaction_id": { "type": "null" },
          "operations": { "minItems": 1 }
        }
      },
      "else": {
        "properties": {
          "pass_group": { "type": "null" },
          "target_transaction_id": { "$ref": "#/$defs/id" },
          "operations": { "maxItems": 0 }
        }
      }
    },
    {
      "if": {
        "properties": {
          "operations": {
            "contains": { "$ref": "#/$defs/restore_range_operation" }
          }
        },
        "required": ["operations"]
      },
      "then": {
        "properties": {
          "operations": { "minItems": 1, "maxItems": 1 }
        }
      }
    },
    {
      "if": {
        "properties": {
          "operations": {
            "contains": { "$ref": "#/$defs/transcript_cut_operation" }
          }
        },
        "required": ["operations"]
      },
      "then": {
        "properties": {
          "operations": { "minItems": 1, "maxItems": 1 }
        }
      }
    },
    {
      "if": {
        "properties": {
          "operations": {
            "contains": { "$ref": "#/$defs/transcript_edit_operation" }
          }
        },
        "required": ["operations"]
      },
      "then": {
        "properties": {
          "operations": { "minItems": 1, "maxItems": 1 }
        }
      }
    }
  ],
  "$defs": {
    "id": {
      "type": "string",
      "pattern": "^[A-Za-z0-9][A-Za-z0-9._-]{1,127}$"
    },
    "hash": { "type": "string", "pattern": "^[a-f0-9]{64}$" },
    "timestamp": {
      "type": "string",
      "pattern": "^\\d{4}-\\d{2}-\\d{2}T\\d{2}:\\d{2}:\\d{2}(?:\\.\\d+)?Z$"
    },
    "pass_group": {
      "type": "object",
      "additionalProperties": false,
      "required": ["pass_group_id", "kind"],
      "properties": {
        "pass_group_id": { "$ref": "#/$defs/id" },
        "kind": {
          "enum": [
            "manual",
            "spoken_cut",
            "layout",
            "zoom",
            "captions",
            "speed",
            "audio",
            "broll",
            "cursor"
          ]
        }
      }
    },
    "clip": {
      "type": "object",
      "additionalProperties": false,
      "required": [
        "clip_id",
        "track_id",
        "source_id",
        "source_start_us",
        "source_end_us",
        "timeline_start_us",
        "timeline_end_us",
        "enabled"
      ],
      "properties": {
        "clip_id": { "$ref": "#/$defs/id" },
        "track_id": { "$ref": "#/$defs/id" },
        "source_id": { "$ref": "#/$defs/id" },
        "source_start_us": { "type": "integer", "minimum": 0 },
        "source_end_us": { "type": "integer", "minimum": 1 },
        "timeline_start_us": { "type": "integer", "minimum": 0 },
        "timeline_end_us": { "type": "integer", "minimum": 1 },
        "enabled": { "const": true }
      }
    },
    "state": {
      "type": "object",
      "additionalProperties": false,
      "required": [
        "schema_version",
        "project_id",
        "draft_id",
        "base_revision_id",
        "draft_sequence",
        "timeline_sha256",
        "head_transaction_sha256",
        "timeline"
      ],
      "properties": {
        "schema_version": { "const": "1.0" },
        "project_id": { "$ref": "#/$defs/id" },
        "draft_id": { "$ref": "#/$defs/id" },
        "base_revision_id": { "$ref": "#/$defs/id" },
        "draft_sequence": { "type": "integer", "minimum": 0 },
        "timeline_sha256": { "$ref": "#/$defs/hash" },
        "head_transaction_sha256": {
          "oneOf": [{ "$ref": "#/$defs/hash" }, { "type": "null" }]
        },
        "timeline": { "$ref": "timeline.schema.json" }
      }
    },
    "ripple_delete_operation": {
      "type": "object",
      "additionalProperties": false,
      "required": [
        "schema_version",
        "operation_id",
        "operation_type",
        "start_us",
        "end_us",
        "before",
        "after",
        "inverse"
      ],
      "properties": {
        "schema_version": { "const": "1.0" },
        "operation_id": { "$ref": "#/$defs/id" },
        "operation_type": { "const": "ripple_delete" },
        "start_us": { "type": "integer", "minimum": 0 },
        "end_us": { "type": "integer", "minimum": 1 },
        "before": {
          "type": "array",
          "minItems": 1,
          "maxItems": 4096,
          "items": { "$ref": "#/$defs/clip" }
        },
        "after": {
          "type": "array",
          "minItems": 1,
          "maxItems": 4096,
          "items": { "$ref": "#/$defs/clip" }
        },
        "inverse": {
          "type": "object",
          "additionalProperties": false,
          "required": ["type", "clips", "expected_after_sha256"],
          "properties": {
            "type": { "const": "restore_timeline_clips" },
            "clips": {
              "type": "array",
              "minItems": 1,
              "maxItems": 4096,
              "items": { "$ref": "#/$defs/clip" }
            },
            "expected_after_sha256": { "$ref": "#/$defs/hash" }
          }
        }
      }
    },
    "restore_range_operation": {
      "type": "object",
      "additionalProperties": false,
      "required": [
        "schema_version",
        "operation_id",
        "operation_type",
        "source_id",
        "source_start_us",
        "source_end_us",
        "before",
        "after",
        "inverse"
      ],
      "properties": {
        "schema_version": { "const": "1.0" },
        "operation_id": { "$ref": "#/$defs/id" },
        "operation_type": { "const": "restore" },
        "source_id": { "$ref": "#/$defs/id" },
        "source_start_us": { "type": "integer", "minimum": 0 },
        "source_end_us": { "type": "integer", "minimum": 1 },
        "before": {
          "type": "array",
          "minItems": 1,
          "maxItems": 4096,
          "items": { "$ref": "#/$defs/clip" }
        },
        "after": {
          "type": "array",
          "minItems": 1,
          "maxItems": 4096,
          "items": { "$ref": "#/$defs/clip" }
        },
        "inverse": {
          "type": "object",
          "additionalProperties": false,
          "required": ["type", "clips", "expected_after_sha256"],
          "properties": {
            "type": { "const": "restore_timeline_clips" },
            "clips": {
              "type": "array",
              "minItems": 1,
              "maxItems": 4096,
              "items": { "$ref": "#/$defs/clip" }
            },
            "expected_after_sha256": { "$ref": "#/$defs/hash" }
          }
        }
      }
    },
    "transcript_cut_operation": {
      "type": "object",
      "additionalProperties": false,
      "required": [
        "schema_version",
        "operation_id",
        "operation_type",
        "source_id",
        "transcript_id",
        "start_word_id",
        "end_word_id",
        "source_start_us",
        "source_end_us",
        "start_us",
        "end_us",
        "before",
        "after",
        "inverse"
      ],
      "properties": {
        "schema_version": { "const": "1.0" },
        "operation_id": { "$ref": "#/$defs/id" },
        "operation_type": { "const": "transcript_cut" },
        "source_id": { "$ref": "#/$defs/id" },
        "transcript_id": { "$ref": "#/$defs/id" },
        "start_word_id": { "$ref": "#/$defs/id" },
        "end_word_id": { "$ref": "#/$defs/id" },
        "source_start_us": { "type": "integer", "minimum": 0 },
        "source_end_us": { "type": "integer", "minimum": 1 },
        "start_us": { "type": "integer", "minimum": 0 },
        "end_us": { "type": "integer", "minimum": 1 },
        "before": {
          "type": "array",
          "minItems": 1,
          "maxItems": 4096,
          "items": { "$ref": "#/$defs/clip" }
        },
        "after": {
          "type": "array",
          "minItems": 1,
          "maxItems": 4096,
          "items": { "$ref": "#/$defs/clip" }
        },
        "inverse": {
          "type": "object",
          "additionalProperties": false,
          "required": ["type", "clips", "expected_after_sha256"],
          "properties": {
            "type": { "const": "restore_timeline_clips" },
            "clips": {
              "type": "array",
              "minItems": 1,
              "maxItems": 4096,
              "items": { "$ref": "#/$defs/clip" }
            },
            "expected_after_sha256": { "$ref": "#/$defs/hash" }
          }
        }
      },
      "description": "One user-selected contiguous half-open source word range mapped to the current output timeline. It shares ripple-delete's reversible clip-map inverse and records its transcript and word identity."
    },
    "transcript_edit_operation": {
      "type": "object",
      "additionalProperties": false,
      "required": [
        "schema_version",
        "operation_id",
        "operation_type",
        "source_id",
        "transcript_id",
        "word_id",
        "original_text",
        "before_text",
        "after_text",
        "before",
        "after",
        "inverse"
      ],
      "properties": {
        "schema_version": { "const": "1.0" },
        "operation_id": { "$ref": "#/$defs/id" },
        "operation_type": { "const": "transcript_edit" },
        "source_id": { "$ref": "#/$defs/id" },
        "transcript_id": { "$ref": "#/$defs/id" },
        "word_id": { "$ref": "#/$defs/id" },
        "original_text": { "type": "string", "minLength": 1, "maxLength": 200 },
        "before_text": { "type": "string", "minLength": 1, "maxLength": 200 },
        "after_text": { "type": "string", "minLength": 1, "maxLength": 200 },
        "before": {
          "type": "array",
          "maxItems": 100000,
          "items": { "$ref": "timeline.schema.json#/$defs/transcript_edit" }
        },
        "after": {
          "type": "array",
          "maxItems": 100000,
          "items": { "$ref": "timeline.schema.json#/$defs/transcript_edit" }
        },
        "inverse": {
          "type": "object",
          "additionalProperties": false,
          "required": ["type", "edits", "expected_after_sha256"],
          "properties": {
            "type": { "const": "restore_transcript_edits" },
            "edits": {
              "type": "array",
              "maxItems": 100000,
              "items": { "$ref": "timeline.schema.json#/$defs/transcript_edit" }
            },
            "expected_after_sha256": { "$ref": "#/$defs/hash" }
          }
        }
      }
    },
    "split_operation": {
      "type": "object",
      "additionalProperties": false,
      "required": [
        "schema_version",
        "operation_id",
        "operation_type",
        "clip_id",
        "timeline_position_us",
        "before",
        "after",
        "inverse"
      ],
      "properties": {
        "schema_version": { "const": "1.0" },
        "operation_id": { "$ref": "#/$defs/id" },
        "operation_type": { "const": "split" },
        "clip_id": { "$ref": "#/$defs/id" },
        "timeline_position_us": { "type": "integer", "minimum": 1 },
        "before": { "$ref": "#/$defs/clip" },
        "after": {
          "type": "array",
          "prefixItems": [
            { "$ref": "#/$defs/clip" },
            { "$ref": "#/$defs/clip" }
          ],
          "minItems": 2,
          "maxItems": 2
        },
        "inverse": {
          "type": "object",
          "additionalProperties": false,
          "required": ["type", "clip", "expected_after_sha256"],
          "properties": {
            "type": { "const": "merge_split" },
            "clip": { "$ref": "#/$defs/clip" },
            "expected_after_sha256": { "$ref": "#/$defs/hash" }
          }
        }
      }
    },
    "trim_operation": {
      "type": "object",
      "additionalProperties": false,
      "required": [
        "schema_version",
        "operation_id",
        "operation_type",
        "clip_id",
        "edge",
        "timeline_position_us",
        "before",
        "after",
        "inverse"
      ],
      "properties": {
        "schema_version": { "const": "1.0" },
        "operation_id": { "$ref": "#/$defs/id" },
        "operation_type": { "const": "trim" },
        "clip_id": { "$ref": "#/$defs/id" },
        "edge": { "enum": ["start", "end"] },
        "timeline_position_us": { "type": "integer", "minimum": 1 },
        "before": { "$ref": "#/$defs/clip" },
        "after": { "$ref": "#/$defs/clip" },
        "inverse": {
          "type": "object",
          "additionalProperties": false,
          "required": ["type", "clip", "expected_after_sha256"],
          "properties": {
            "type": { "const": "restore_clip" },
            "clip": { "$ref": "#/$defs/clip" },
            "expected_after_sha256": { "$ref": "#/$defs/hash" }
          }
        }
      }
    }
  }
}
