{
  "schema_version": "1.0",
  "transaction_id": "transaction-restore-002",
  "request_id": "request-restore-002",
  "request_sha256": "6666666666666666666666666666666666666666666666666666666666666666",
  "transaction_sha256": "2222222222222222222222222222222222222222222222222222222222222222",
  "previous_transaction_sha256": "1111111111111111111111111111111111111111111111111111111111111111",
  "project_id": "project-demo-001",
  "draft_id": "draft-demo-001",
  "base_revision_id": "rev-001",
  "kind": "apply",
  "origin": "codex",
  "pass_group": { "pass_group_id": "pass-spoken-002", "kind": "spoken_cut" },
  "reason": "Restore the confirmed source interval removed by the prior cut.",
  "created_at": "2026-09-12T12:01:00.000Z",
  "target_transaction_id": null,
  "before": {
    "schema_version": "1.0",
    "project_id": "project-demo-001",
    "draft_id": "draft-demo-001",
    "base_revision_id": "rev-001",
    "draft_sequence": 1,
    "timeline_sha256": "3333333333333333333333333333333333333333333333333333333333333333",
    "head_transaction_sha256": "1111111111111111111111111111111111111111111111111111111111111111",
    "timeline": {
      "schema_version": "1.0",
      "timeline_id": "timeline-rev-001",
      "project_id": "project-demo-001",
      "revision_id": "rev-001",
      "duration_us": 800000,
      "frame_rate": { "numerator": 30, "denominator": 1 },
      "canvas": { "width": 2560, "height": 1440, "aspect_ratio": "custom" },
      "tracks": [
        { "track_id": "track-main", "kind": "main_video", "order": 0, "visible": true, "locked": false }
      ],
      "clips": [
        { "clip_id": "clip-left", "track_id": "track-main", "source_id": "source-screen-001", "source_start_us": 0, "source_end_us": 200000, "timeline_start_us": 0, "timeline_end_us": 200000, "enabled": true },
        { "clip_id": "clip-right", "track_id": "track-main", "source_id": "source-screen-001", "source_start_us": 400000, "source_end_us": 1000000, "timeline_start_us": 200000, "timeline_end_us": 800000, "enabled": true }
      ],
      "operation_ids": ["operation-delete-001"],
      "zoom_ids": [],
      "speed_ids": [],
      "created_at": "2026-09-12T12:00:00.000Z"
    }
  },
  "after": {
    "schema_version": "1.0",
    "project_id": "project-demo-001",
    "draft_id": "draft-demo-001",
    "base_revision_id": "rev-001",
    "draft_sequence": 2,
    "timeline_sha256": "4444444444444444444444444444444444444444444444444444444444444444",
    "head_transaction_sha256": "2222222222222222222222222222222222222222222222222222222222222222",
    "timeline": {
      "schema_version": "1.0",
      "timeline_id": "timeline-rev-001",
      "project_id": "project-demo-001",
      "revision_id": "rev-001",
      "duration_us": 1000000,
      "frame_rate": { "numerator": 30, "denominator": 1 },
      "canvas": { "width": 2560, "height": 1440, "aspect_ratio": "custom" },
      "tracks": [
        { "track_id": "track-main", "kind": "main_video", "order": 0, "visible": true, "locked": false }
      ],
      "clips": [
        { "clip_id": "clip-left", "track_id": "track-main", "source_id": "source-screen-001", "source_start_us": 0, "source_end_us": 200000, "timeline_start_us": 0, "timeline_end_us": 200000, "enabled": true },
        { "clip_id": "clip-restored", "track_id": "track-main", "source_id": "source-screen-001", "source_start_us": 200000, "source_end_us": 400000, "timeline_start_us": 200000, "timeline_end_us": 400000, "enabled": true },
        { "clip_id": "clip-right", "track_id": "track-main", "source_id": "source-screen-001", "source_start_us": 400000, "source_end_us": 1000000, "timeline_start_us": 400000, "timeline_end_us": 1000000, "enabled": true }
      ],
      "operation_ids": ["operation-delete-001", "operation-restore-002"],
      "zoom_ids": [],
      "speed_ids": [],
      "created_at": "2026-09-12T12:00:00.000Z"
    }
  },
  "operations": [
    {
      "schema_version": "1.0",
      "operation_id": "operation-restore-002",
      "operation_type": "restore",
      "source_id": "source-screen-001",
      "source_start_us": 200000,
      "source_end_us": 400000,
      "before": [
        { "clip_id": "clip-left", "track_id": "track-main", "source_id": "source-screen-001", "source_start_us": 0, "source_end_us": 200000, "timeline_start_us": 0, "timeline_end_us": 200000, "enabled": true },
        { "clip_id": "clip-right", "track_id": "track-main", "source_id": "source-screen-001", "source_start_us": 400000, "source_end_us": 1000000, "timeline_start_us": 200000, "timeline_end_us": 800000, "enabled": true }
      ],
      "after": [
        { "clip_id": "clip-left", "track_id": "track-main", "source_id": "source-screen-001", "source_start_us": 0, "source_end_us": 200000, "timeline_start_us": 0, "timeline_end_us": 200000, "enabled": true },
        { "clip_id": "clip-restored", "track_id": "track-main", "source_id": "source-screen-001", "source_start_us": 200000, "source_end_us": 400000, "timeline_start_us": 200000, "timeline_end_us": 400000, "enabled": true },
        { "clip_id": "clip-right", "track_id": "track-main", "source_id": "source-screen-001", "source_start_us": 400000, "source_end_us": 1000000, "timeline_start_us": 400000, "timeline_end_us": 1000000, "enabled": true }
      ],
      "inverse": {
        "type": "restore_timeline_clips",
        "clips": [
          { "clip_id": "clip-left", "track_id": "track-main", "source_id": "source-screen-001", "source_start_us": 0, "source_end_us": 200000, "timeline_start_us": 0, "timeline_end_us": 200000, "enabled": true },
          { "clip_id": "clip-right", "track_id": "track-main", "source_id": "source-screen-001", "source_start_us": 400000, "source_end_us": 1000000, "timeline_start_us": 200000, "timeline_end_us": 800000, "enabled": true }
        ],
        "expected_after_sha256": "5555555555555555555555555555555555555555555555555555555555555555"
      }
    }
  ],
  "status": "committed"
}
